[
  {
    "id": "1",
    "name": "新宿変電所",
    "name_original": "新宿変電所",
    "name_normalized": "新宿変電所",
    "utility": "TEPCO",
    "voltage_kv": 66,
    "available_kw": 2000,
    "updated_at": "2025-11-25",
    "lat": 35.6947037,
    "lon": 139.6865963,
    "matched_source": "nominatim",
    "confidence": 0.75,
    "notes": "query='新宿変電所' display='淀橋変電所, 新宿区, 東京都, 160-8484, 日本'"
  },
  {
    "id": "2",
    "name": "渋谷変電所",
    "name_original": "渋谷変電所",
    "name_normalized": "渋谷変電所",
    "utility": "TEPCO",
    "voltage_kv": 66,
    "available_kw": 1500,
    "updated_at": "2025-11-25",
    "lat": 35.4360352,
    "lon": 139.5011171,
    "matched_source": "nominatim",
    "confidence": 0.75,
    "notes": "query='渋谷変電所' display='変電所前, かまくらみち, 阿久和南三丁目, 阿久和南, 瀬谷区, 横浜市, 神奈川県, 246-0026, 日本'"
  }
]