[
  {
    "id": "tepco_1",
    "name": "新宿変電所",
    "name_original": "新宿変電所",
    "name_normalized": "新宿変電所",
    "utility": "TEPCO",
    "voltage_kv": 66,
    "available_kw": 2000,
    "updated_at": "2025-11-26",
    "lat": null,
    "lon": null,
    "matched_source": "unmatched",
    "confidence": 0,
    "notes": ""
  },
  {
    "id": "tepco_2",
    "name": "渋谷変電所",
    "name_original": "渋谷変電所",
    "name_normalized": "渋谷変電所",
    "utility": "TEPCO",
    "voltage_kv": 66,
    "available_kw": 1500,
    "updated_at": "2025-11-26",
    "lat": null,
    "lon": null,
    "matched_source": "unmatched",
    "confidence": 0,
    "notes": ""
  },
  {
    "id": "tepco_3",
    "name": "池袋変電所",
    "name_original": "池袋変電所",
    "name_normalized": "池袋変電所",
    "utility": "TEPCO",
    "voltage_kv": 66,
    "available_kw": 1800,
    "updated_at": "2025-11-26",
    "lat": null,
    "lon": null,
    "matched_source": "unmatched",
    "confidence": 0,
    "notes": ""
  },
  {
    "id": "tepco_4",
    "name": "荻窪線",
    "name_original": "荻窪線",
    "name_normalized": "荻窪線",
    "utility": "TEPCO",
    "voltage_kv": 154,
    "available_kw": 5000,
    "updated_at": "2025-11-26",
    "lat": null,
    "lon": null,
    "matched_source": "unmatched",
    "confidence": 0,
    "notes": ""
  },
  {
    "id": "tepco_5",
    "name": "新京葉線",
    "name_original": "新京葉線",
    "name_normalized": "新京葉線",
    "utility": "TEPCO",
    "voltage_kv": 275,
    "available_kw": 8000,
    "updated_at": "2025-11-26",
    "lat": null,
    "lon": null,
    "matched_source": "unmatched",
    "confidence": 0,
    "notes": ""
  }
]