[
  {
    "id": "1",
    "name": "新宿変電所",
    "utility": "TEPCO",
    "voltage_kv": 66,
    "available_kw": 2000,
    "updated_at": "2025-11-25",
    "lon": 139.6865963,
    "lat": 35.6947037,
    "matched_source": "nominatim",
    "confidence": 0.75
  },
  {
    "id": "2",
    "name": "渋谷変電所",
    "utility": "TEPCO",
    "voltage_kv": 66,
    "available_kw": 1500,
    "updated_at": "2025-11-25",
    "lon": 139.5011171,
    "lat": 35.4360352,
    "matched_source": "nominatim",
    "confidence": 0.75
  },
  {
    "id": "3",
    "name": "池袋変電所",
    "utility": "TEPCO",
    "voltage_kv": 66,
    "available_kw": 1800,
    "updated_at": "2025-11-25",
    "lon": 139.6963716,
    "lat": 35.5699419,
    "matched_source": "nominatim",
    "confidence": 0.75
  },
  {
    "id": "4",
    "name": "荻窪線",
    "utility": "TEPCO",
    "voltage_kv": 154,
    "available_kw": 5000,
    "updated_at": "2025-11-25",
    "lon": null,
    "lat": null,
    "matched_source": "unmatched",
    "confidence": 0
  },
  {
    "id": "5",
    "name": "新京葉線",
    "utility": "TEPCO",
    "voltage_kv": 275,
    "available_kw": 8000,
    "updated_at": "2025-11-25",
    "lon": null,
    "lat": null,
    "matched_source": "unmatched",
    "confidence": 0
  }
]
