[
  {
    "id": "tepco_saitama_1",
    "name": "新岡部",
    "name_original": "新岡部",
    "name_normalized": "新岡部",
    "utility": "TEPCO",
    "voltage_kv": 154,
    "available_kw": 0,
    "updated_at": "2025-11-25",
    "lat": null,
    "lon": null,
    "matched_source": "unmatched",
    "confidence": 0,
    "notes": "source=csv_akiyouryou_saitama_hendensyo.csv"
  },
  {
    "id": "tepco_saitama_2",
    "name": "埼玉",
    "name_original": "埼玉",
    "name_normalized": "埼玉",
    "utility": "TEPCO",
    "voltage_kv": 66,
    "available_kw": 426000,
    "updated_at": "2025-11-25",
    "lat": null,
    "lon": null,
    "matched_source": "unmatched",
    "confidence": 0,
    "notes": "source=csv_akiyouryou_saitama_hendensyo.csv"
  },
  {
    "id": "tepco_saitama_3",
    "name": "北東京",
    "name_original": "北東京",
    "name_normalized": "北東京",
    "utility": "TEPCO",
    "voltage_kv": 154,
    "available_kw": 2409000,
    "updated_at": "2025-11-25",
    "lat": null,
    "lon": null,
    "matched_source": "unmatched",
    "confidence": 0,
    "notes": "source=csv_akiyouryou_saitama_hendensyo.csv"
  },
  {
    "id": "tepco_saitama_4",
    "name": "岩槻",
    "name_original": "岩槻",
    "name_normalized": "岩槻",
    "utility": "TEPCO",
    "voltage_kv": 66,
    "available_kw": 554000,
    "updated_at": "2025-11-25",
    "lat": null,
    "lon": null,
    "matched_source": "unmatched",
    "confidence": 0,
    "notes": "source=csv_akiyouryou_saitama_hendensyo.csv"
  },
  {
    "id": "tepco_saitama_5",
    "name": "南川越",
    "name_original": "南川越",
    "name_normalized": "南川越",
    "utility": "TEPCO",
    "voltage_kv": 154,
    "available_kw": 1138000,
    "updated_at": "2025-11-25",
    "lat": null,
    "lon": null,
    "matched_source": "unmatched",
    "confidence": 0,
    "notes": "source=csv_akiyouryou_saitama_hendensyo.csv"
  },
  {
    "id": "tepco_saitama_6",
    "name": "中東京",
    "name_original": "中東京",
    "name_normalized": "中東京",
    "utility": "TEPCO",
    "voltage_kv": 154,
    "available_kw": 288000,
    "updated_at": "2025-11-25",
    "lat": null,
    "lon": null,
    "matched_source": "unmatched",
    "confidence": 0,
    "notes": "source=csv_akiyouryou_saitama_hendensyo.csv"
  },
  {
    "id": "tepco_saitama_7",
    "name": "奥秩父",
    "name_original": "奥秩父",
    "name_normalized": "奥秩父",
    "utility": "TEPCO",
    "voltage_kv": 66,
    "available_kw": 89000,
    "updated_at": "2025-11-25",
    "lat": null,
    "lon": null,
    "matched_source": "unmatched",
    "confidence": 0,
    "notes": "source=csv_akiyouryou_saitama_hendensyo.csv"
  },
  {
    "id": "tepco_saitama_8",
    "name": "北葛飾",
    "name_original": "北葛飾",
    "name_normalized": "北葛飾",
    "utility": "TEPCO",
    "voltage_kv": 154,
    "available_kw": 1018000,
    "updated_at": "2025-11-25",
    "lat": null,
    "lon": null,
    "matched_source": "unmatched",
    "confidence": 0,
    "notes": "source=csv_akiyouryou_saitama_hendensyo.csv"
  },
  {
    "id": "tepco_saitama_9",
    "name": "東八潮",
    "name_original": "東八潮",
    "name_normalized": "東八潮",
    "utility": "TEPCO",
    "voltage_kv": 66,
    "available_kw": 436000,
    "updated_at": "2025-11-25",
    "lat": null,
    "lon": null,
    "matched_source": "unmatched",
    "confidence": 0,
    "notes": "source=csv_akiyouryou_saitama_hendensyo.csv"
  },
  {
    "id": "tepco_saitama_10",
    "name": "京北",
    "name_original": "京北",
    "name_normalized": "京北",
    "utility": "TEPCO",
    "voltage_kv": 154,
    "available_kw": 682000,
    "updated_at": "2025-11-25",
    "lat": null,
    "lon": null,
    "matched_source": "unmatched",
    "confidence": 0,
    "notes": "source=csv_akiyouryou_saitama_hendensyo.csv"
  }
]